<?xml version="1.0" encoding="UTF-8"?>

<!-- New XML document created with EditiX XML Editor (http://www.editix.com) at Sat Feb 18 11:35:22 CET 2017 -->


<!DOCTYPE A SYSTEM "dtd3.dtd">
<A>
	<B>
		<C>
			4
		</C>
	</B>
	<D>
		<F>
			5
		</F>
		<F>
			6
		</F>
	</D>
	<D />
	<F>
		7
	</F>
</A>
